{
  "candidate_ref": "candidate:aoa-techniques:agon/request-evidence-practice",
  "source_part": "move-technique-bridge",
  "source_status": "requested_not_landed",
  "source_label": "request_evidence",
  "gate_card": "mechanics/distillation/parts/agon-candidate-handoff/gates/request-evidence-practice.md",
  "distillation_lane": "first_narrowing_watch",
  "distillation_gate": {
    "atomic_move_status": "candidate_named",
    "atomic_move_note": "ask for the smallest missing evidence object that would change the review state",
    "likely_domain": "agent-workflows",
    "primary_kind": "evidence-request",
    "family_posture": "evidence-request practice; not yet a bundle",
    "capability_class": "request-evidence",
    "substrate": "review state",
    "execution_profile": "small-agent",
    "risk_posture": "evidence-theater",
    "portable_core": "portable as a small evidence request outside OS Abyss and outside Agon protocol"
  },
  "bridge": {
    "higher_law": "Agents-of-Abyss mechanics/agon owns evidence move law.",
    "local_route": "Run one gate card focused on missing evidence object, review state, and stop condition.",
    "nearest_wrong_owner": "aoa-evals",
    "bridge_stop_line": "Do not treat an evidence request as proof, verdict, or eval authority."
  },
  "next_move": "Use the landed gate card to draft a minimal public-safe example before any bundle pass."
}
